Dataset Name,Question
golden_globe_awards.csv,is there any outlier in the winners of best television according to age ?
golden_globe_awards.csv,"in regards to the ages of best television winners , i 'd like to know if there are any outliers in that distribution ."
golden_globe_awards.csv,"in the best television category , are there any winners that are significantly older or younger than all the others ?"
golden_globe_awards.csv,"in the best television category , is there any winner that is an outlier considering age ?"
golden_globe_awards.csv,"based on age alone , do you think there is an outlier in the winners of best television category ?"
golden_globe_awards.csv,can you tell me if there is any outlier in the winners of best television according to age .
golden_globe_awards.csv,indicate any age outliers from best television winners .
golden_globe_awards.csv,are any outliers present in the age of winners of best television ?
golden_globe_awards.csv,do any best television winners fall outside the average age range ?
golden_globe_awards.csv,are there any extremely young or old winners of the best television award ?
golden_globe_awards.csv,list any and all outliers from the winners of the best television in relation to age ?
golden_globe_awards.csv,check if there is an outlier in the winners of best television according to age .
golden_globe_awards.csv,looking at the winners of best television is there an irregularly when it comes to age ?
golden_globe_awards.csv,are there any results which lie far outside the normal range among people who have received awards for best television ?
googleplaystore.csv,find the outlier of the ratings among gaming apps .
googleplaystore.csv,"among the ratings of the gaming apps , please find and show the outlier (s ) ."
googleplaystore.csv,find a gaming app that has a rating that falls outside the normal range of scores .
googleplaystore.csv,identify any outlier amongst ratings for gaming apps .
googleplaystore.csv,"among gaming app , find the outlier of the ratings"
googleplaystore.csv,locate the gaming apps ratings outlier .
googleplaystore.csv,determine the outlier of the ratings among gaming apps .
googleplaystore.csv,what are the outlier ratings of the gaming apps ?
googleplaystore.csv,point out the ratings outlier among gaming apps .
googleplaystore.csv,discover the outlier from the ratings among apps .
googleplaystore.csv,seek the outlier of ratings on gaming apps .
googleplaystore.csv,what ratings among gaming apps are outside of the normal range ?
googleplaystore.csv,i request you to find the outlier of the ratings among gaming apps
googleplaystore.csv,which ratings of gaming apps are outside of the standard distributions ?
googleplaystore.csv,which gaming app is an outlier among the others ?
googleplaystore.csv,search where the outlier of the ratings among gaming apps can be located .
googleplaystore.csv,are there any outliers among the ratings of gaming apps ?
googleplaystore.csv,determine if there are any outliers in terms of the gaming app ratings .
googleplaystore.csv,"looking at the ratings of gaming apps , are any far above or below the other ratings ?"
googleplaystore.csv,"in regards to the ratings of the gaming apps , can you find any outliers ?"
googleplaystore.csv,are there any anomalies in the ratings of gaming apps
googleplaystore.csv,"amongst gaming apps , are there any outliers with respect to their ratings ?"
googleplaystore.csv,do gaming apps have an outliers among the ratings ?
googleplaystore.csv,from the ratings of gaming apps are there any outliers ?
googleplaystore.csv,show me if there are any outliers among the ratings of gaming apps
googleplaystore.csv,show me the outliers among the ratings of gaming apps .
googleplaystore.csv,tell me if there are any exceptions among the ratings for gaming apps .
googleplaystore.csv,do you know of any gaming apps ratings outliers ?
googleplaystore.csv,what gaming app ratings have outliers ?
googleplaystore.csv,are there any unusual ratings among gaming apps ?
googleplaystore.csv,who are the outliers of the gaming apps ratings ?
googleplaystore.csv,identify gaming apps whose ratings are significantly above or below the rest of the gaming app ratings .
googleplaystore.csv,"which gaming apps , if any , are considered an outlier ?"
schools.csv,are there any regions that have schools with a rank difference of over 200 ?
schools.csv,which regions have schools with a rank difference of more than 200 ?
schools.csv,are there regions with schools with a difference in rank greater than 200 ?
schools.csv,find any region that has schools with a rank difference higher than 200 .
schools.csv,what regions if any contain schools with a difference in rank above two hundred
schools.csv,do any regions exist that contain schools with a rank difference greater than 200 ?
schools.csv,tell me the regions that have schools with difference in their ranks greater than 200 .
schools.csv,identify any regions that have schools with a rank difference of over 200 .
schools.csv,"which regions have schools with a rank difference over 200 , if any ?"
schools.csv,"by region , are there any schools with a rank difference higher than 200 ?"
schools.csv,show me the regions where schools rank a difference over 200 if any .
schools.csv,"which regions , if any , have schools with a rank difference of over 200 ?"
schools.csv,list any regions that have schools with a 200 rank difference or more .
schools.csv,tell me if there are any regions with schools that have a rank difference of over 200
schools.csv,"if applicable , list any regions containing schools that have a rank difference of 200 of more ."
schools.csv,do any areas have academic institutions that are rated with a separation of more than 200 ?
schools.csv,tell me if there is any region with a rank difference of over 200 between schools .
population.csv,does any county in montana have far more non -white population than the others ?
population.csv,"in the state of montana , do any counties have a considerably higher non -white population count than others ?"
population.csv,which montana county has a larger non -white popultion compared to others ?
population.csv,are there any counties in montana with a much greater non -white population than the others ?
population.csv,which counties in montana have a larger nonwhite population ?
population.csv,does montana have any counties with a standout number of non -white people ?
population.csv,are there counties in montana that have more non -white people than others ?
population.csv,is there a county existing in montana containing a noticeably greater amount of inhabitants who are not causasian ?
population.csv,is there a montana county with significantly more non -white population than others ?
population.csv,tell me if there is a county in montana with significantly more non -white people than others .
population.csv,"which county in montana , if any , has a non -white population significantly greater than other counties ?"
population.csv,are there any counties in montana that have much less white people than the others ?
population.csv,"which , if any , county in montana has many more white people than other groups ?"
population.csv,which county in montana has a higher population of non -white people compared to others .
population.csv,is there any more non -white population in any county in montana than the others ?
population.csv,where in montana does a county have far more non -white population than the others ?
golden_globe_awards.csv,is there anything wrong with the number of movies released in 2000 ?
golden_globe_awards.csv,is there an error in the number of released movies for 2000 ?
golden_globe_awards.csv,"what problems , if any , surround the number of movies released in 2000 ?"
golden_globe_awards.csv,is there an error with how many movies were released in the year 2000 ?
golden_globe_awards.csv,are there any problems with the number of movies released in the year 2000 ?
golden_globe_awards.csv,are there any anomalies with respect to the number of movies released in 2000 ?
golden_globe_awards.csv,can you tell me what is wrong with the number of movies released in 2000 ?
golden_globe_awards.csv,is there anything wrong with how many movies were released in 2000
golden_globe_awards.csv,"with the number of films released in 2000 , are there any problems ?"
golden_globe_awards.csv,is the any problem with the number of movies released in 2000 ?
golden_globe_awards.csv,tell me if there were any errors with the amount of movies released in 2000 ?
golden_globe_awards.csv,what is wrong with the number of movies released in 2000 ?
golden_globe_awards.csv,"knowing how many movies were released in 2000 , do you think there is anything wrong with this number ?"
golden_globe_awards.csv,is the number of movies released in 2000 normal ?
golden_globe_awards.csv,are there any discrepancies with the number of movies released in 2000 ?
schools.csv,does the number of private schools have any anomalies in geita in 2009 ?
schools.csv,is there any anomalies in the number of private schools in geita during 2009 ?
schools.csv,was there an anomaly in the number of privates schools in geita in 2009 ?
schools.csv,"in geita , were there any anomalies in the private schools in 2009 ?"
schools.csv,does the quantity of non -public schools have any inconsistencies in geita in 2009 ?
schools.csv,are there any anomalies in the number of private schools in 2009 for geita ?
schools.csv,are there any anomalies in the number of private schools in 2009 in geita ?
schools.csv,can you tell me if the number of private schools in geita in 2009 show any anomalies ?
schools.csv,can you tell me if the number of private schools in geita have any anomalies in 2009 ?
schools.csv,"in 2009 , was there any anomalies with respect to the number of private schools in geita ?"
schools.csv,"in geita in 2009 , did the number of private schools have any anomalies ?"
schools.csv,"are there any anomalies in the number of private schools , in geita , in 2006 ?"
schools.csv,in 2009 what is the number of anomalies among private schools in geita ?
schools.csv,how many anomalies did private schools have in geita in 2009 ?
schools.csv,show me the number of private schools in geita with anomalies in 2009 .
schools.csv,"for 2009 , is the number of private schools in geita outside the given norm ?"
schools.csv,are there any anomalies in the region of geita of private schools in the year 2009 ?
schools.csv,are there any anomalities in the amount of private schools located in geita in the year 2006 ?
schools.csv,what amount of private schools in gita have any anomalies in 2009 ?
schools.csv,are there anomalies in the pass rate of waja springs pr . school in 2006 ?
schools.csv,"in 2006 , were there any anomalies with respect to the pass rate of waja springs pr . school ?"
schools.csv,"in the passing rate of waja springs pr . school , are there any anomalies in 2006 ?"
schools.csv,"in 2006 , did any anomalies exist with regards to the rate of passage of waja springs pr . school ?"
schools.csv,can any abnormalities be found in the pass rates of waja springs pr . school in 2006 ?
schools.csv,are there any passing rate anomalies in 2006 for waja springs pr . school ?
schools.csv,are there irregularities in the pass pace of waja springs pr . school in 2006 ?
schools.csv,are any anomalies present among the pass rate of students in waja springs pr . school in the year 2006 ?
schools.csv,is there something different about the pass rate of waja springs pr . school in 2006 ?
schools.csv,"using the 2006 waja springs pr . school pass rate data , identify any anomolies or outliers ."
schools.csv,show me if there are anomalies in the pass rate of waja springs pr . school in 2006 .
schools.csv,did waja springs pr . school have any anomalies in 2006 ?
schools.csv,indicate any anomalies in 2006 for the pass rate of waja springs pr . school .
schools.csv,what were the outliers in 2006 in the pass rate of waja springs pr . school ?
schools.csv,does the pass rate of waja springs pr . school in 2006 appear out of the ordinary ?
schools.csv,"for the pass rate of waja springs pr . school in 2006 , is there anything unusual or unexpected ?"
schools.csv,what if any are the anomalies in the pass rate of the 2006 waja springs pr school
schools.csv,could you tell me any irregularities in the waja springs pr . school past rate in 2006 ?
bike.csv,"is there any trip that takes more than 1,000 minutes ?"
bike.csv,do you know of any trip that would take longer than 1000 minutes ?
bike.csv,"do any trips have a longer commute than 1,000 minutes ?"
bike.csv,"are there any trips that take longer than 1,000 minutes ?"
bike.csv,"are any trips longer than 1,000 minutes ?"
bike.csv,"do you know of any trips that take longer than 1,000 minutes ?"
bike.csv,"does the travel time of any trips require more than 1,000 minutes ?"
bike.csv,"what trips , if any , take longer than 1,000 minutes"
bike.csv,"are there any trips that take more than 1,000 minutes ?"
bike.csv,"do you know of any trips that might take more than 1,000 minutes ?"
bike.csv,"tell me trips that are longer than 1,000 minutes"
bike.csv,show me any trips that take more than 1000 minutes .
bike.csv,"name a trip which takes longer than 1,000 minutes"
bike.csv,"when thinking of trips that take more than 1,000 minutes , are there any that comes to mind ?"
bike.csv,"can you tell me if there are any trips that take more than 1,000 minutes ?"
bike.csv,"show me if there any tip that takes more than 1,000 minutes !"
bike.csv,"show me a trip that takes more 1,000 minutes ."
