Dataset Name,Question
top-50-us-universities.csv,is the number of teachers in harvard university out of the normal range ?
top-50-us-universities.csv,"at harvard university , does the total number of teachers fall into an average range ."
top-50-us-universities.csv,does harvard university have a number of teachers outside the normal range ?
top-50-us-universities.csv,can you tell if the number of teachers in harvard university is out of the normal range ?
top-50-us-universities.csv,does harvard university lay outside the normal range for teacher count ?
top-50-us-universities.csv,does harvard university have a number of teachers in the normal range ?
top-50-us-universities.csv,determine if the number of teachers is out of the normal range for harvard university .
top-50-us-universities.csv,does harvard university have teacher outside of normal range ?
top-50-us-universities.csv,would you say the number of harvard university teaches is out of the normal range ?
top-50-us-universities.csv,what is the normal range for teachers at harvard university ?
top-50-us-universities.csv,does the number of teachers at harvard university fall in the normal range ?
top-50-us-universities.csv,does harvard have a typical faculty in regards to numbers ?
top-50-us-universities.csv,is the instructional staff at harvard university abnormally large compared to others ?
top-50-us-universities.csv,is the number of teachers at harvard normal or abnormal ?
top-50-us-universities.csv,"if harvard university was located in new york , would the number of teachers in harvard be considered outliers in relation to all the universities in new york ?"
top-50-us-universities.csv,"would harvard teachers be classed as outliers in regards to universities in new york , if harvard were located in new york ?"
top-50-us-universities.csv,"would harvard teachers be considered outliers to all new york universities , if harvard university was located in new york ?"
top-50-us-universities.csv,"would the amount of teachers at harvard be considered outliers in respect to all other universities in new york , if harvard was in new york ."
top-50-us-universities.csv,would the number of teachers in harvard be considered outliers relative to universities in new york if harvard university was in new york ?
top-50-us-universities.csv,would teachers in harvard be considered outliers if the university was in new york ?
top-50-us-universities.csv,would the number of teachers in harvard be considered outliers if harvard university was located in new york in relation to every other university in new york ?
top-50-us-universities.csv,"can we say that if harvard university was located in new york , the number of teachers would be considered outliers in relation to all the universities in new york ?"
top-50-us-universities.csv,"in relation to all the other universities in new york , would the number of teachers in harvard be considered outliers ?"
top-50-us-universities.csv,let us say harvard university is in new york ; what number of all the teachers at harvard be considered outliers compared to the other universities in new york ?
top-50-us-universities.csv,"for example , if harvard university was located in new york , would the amount of teachers at harvard be different to the other universities in new york ?"
top-50-us-universities.csv,"if you imagine harvard university was in new york , do you think the number of harvard professors would be different than those of the other universities in new york ?"
top-50-us-universities.csv,"if new york was the state where harvard university was located , would the number of teachers in harvard be outliers , compared to all the universities in new york ?"
top-50-us-universities.csv,could we expect the quantity of teachers at harvard university to be an aberration compared to other universities in new york if we were to assume harvard was in new york ?
top-50-us-universities.csv,"what if harvard university was in new york ,would the percent of teachers in harvard be considered outliers in relation to all the universities in the state of new york ."
sub-est2002-01.csv,is there a city that has a larger population than a state ?
sub-est2002-01.csv,show me a single city whose population is greater than that of a state ?
sub-est2002-01.csv,does there exist a city that has a population larger than a state ?
sub-est2002-01.csv,are there any cities that have populations which are larger than that of an entire state ?
sub-est2002-01.csv,is there a city whose population bigger than a state ?
sub-est2002-01.csv,can you tell me if any city has a population larger than a state ?
sub-est2002-01.csv,are there any cities that have a larger population compared to the state populations ?
sub-est2002-01.csv,are there any cities with a larger population than a state ?
sub-est2002-01.csv,are there any cities that have a larger population than a state ?
sub-est2002-01.csv,which cities have a larger population than the lowest state population
sub-est2002-01.csv,what city 's population is greater than an entire state 's population ?
sub-est2002-01.csv,tell me what city has more people in it than any state has in total .
sub-est2002-01.csv,which cities have a larger population than a state ?
sub-est2002-01.csv,what city has a larger population than a state ?
sub-est2002-01.csv,what is the city that is more populous than a state ?
sub-est2002-01.csv,"in relation to the states , is there a city that has a greater population ?"
sub-est2002-01.csv,can you name a city who 's populated by more people than another state ?
JPvideos.csv,are there any videos with dislikes ?
JPvideos.csv,have any of the videos been disliked ?
JPvideos.csv,do any of the videos have dislikes ?
JPvideos.csv,"of all the videos , are there any that are disliked ?"
JPvideos.csv,are there videos with dislikes ?
JPvideos.csv,can you show me videos with dislikes ?
JPvideos.csv,please let me know if any videos have received any dislikes .
JPvideos.csv,did any video get a dislike ?
JPvideos.csv,what videos have dislikes ?
JPvideos.csv,show the videos with dislikes .
JPvideos.csv,which videos have dislikes ?
JPvideos.csv,give me videos that have received dislikes .
JPvideos.csv,how many videos have dislikes ?
JPvideos.csv,show if any vdeos have dislikes .
JPvideos.csv,has the dislike button been activated on any videos ?
JPvideos.csv,which videos are disliked ?
JPvideos.csv,is it possible to identify any video with deslikes ?
JPvideos.csv,are there any videos with missing thumbnail links ?
JPvideos.csv,are there any thumbnail links that are missing in videos ?
JPvideos.csv,i would like to know if any of these videos contain any missing thumbnail links ?
JPvideos.csv,determine if thumbnail links are missing on any of the videos .
JPvideos.csv,do any videos contain missing thumbnail links ?
JPvideos.csv,are there missing thumbnail links for any of the videos ?
JPvideos.csv,could you show me if any videos have missing thumbnail links ?
JPvideos.csv,what videos are missing thumbnail links ?
JPvideos.csv,are there any thumbnail links that are missing from the videos ?
JPvideos.csv,which videos are missing thumbnail links ?
JPvideos.csv,how many videos have missing thumbnail links ?
JPvideos.csv,which of the videos lack thumbnail links ?
JPvideos.csv,which videos have missing thumbnail links ?
JPvideos.csv,i would like ot know if any videos are missing thumbnail links .
JPvideos.csv,how many videos have thumbnail links that are missing ?
JPvideos.csv,are any of the videos posted missing links to access them ?
JPvideos.csv,where are the videos with missing thumbnail links ?
JPvideos.csv,"identify videos with missing thumbnail links , as applicable ."
googleplaystore.csv,are there any free apps that cost more than 0 ?
googleplaystore.csv,tell me if there are any free apps that cost more than $0 dollars .
googleplaystore.csv,find me any free apps with a cost greater than 0 .
googleplaystore.csv,do any free apps exist that cost more than 0 ?
googleplaystore.csv,which apps cost more than 0 that are free ?
googleplaystore.csv,what free apps cost more than 0 ?
googleplaystore.csv,can you tell me if there are any free apps that cost more than 0 ?
googleplaystore.csv,which free apps cost more than 0 ?
googleplaystore.csv,which free app costs above 0 ?
googleplaystore.csv,show the free apps that cost more than 0 .
googleplaystore.csv,can you tell me if there are any apps that cost more than 0 that are also free ?
googleplaystore.csv,which free app cost more than 0 usd ?
googleplaystore.csv,show me apps priced above 0 and are free .
googleplaystore.csv,could there be free apps costing morethan 0 ?
googleplaystore.csv,free apps that cost more than 0 ?
googleplaystore.csv,are there any apps that are free that cost 0 or more ?
googleplaystore.csv,can you tell me if any apps that are free cost more that . 00$ ?
Suicide.csv,are there any records that have a suicide rate less than 0 ?
Suicide.csv,is the suicide rate less than 0 on any of the records ?
Suicide.csv,are there any records that have a suicide rate under 0 ?
Suicide.csv,is there recordings of a suicide rate being less than 0 ?
Suicide.csv,do any records exist that have a suicide rate less than 0 ?
Suicide.csv,do any records have a less than 0 suicide rate ?
Suicide.csv,is there any records that show a rate of suicide that is less than 0 .
Suicide.csv,are there any records that have a suicide rate less than 0 >
Suicide.csv,is there a suicide rate that 's less than 0 ?
Suicide.csv,is there records for suicide rates less than 0 ?
Suicide.csv,will there be any records that have a suicide rate less than 0 ?
Suicide.csv,can you find any history with a rate less than 0 for suicide ?
Suicide.csv,what records have a suicide rate less than 0 ?
Suicide.csv,are there negative suicide rates in any records ?
Suicide.csv,can you find a record that has less than zero suicide rate ?
Suicide.csv,produce any records of suicide rates that are fewer than 0 .
Suicide.csv,which records have suicide rates less than 0 ?
Suicide.csv,do you see any data that shows a negative rate for suicide ?
Suicide.csv,are there any years with suicide rates that are much larger than that of other years ?
Suicide.csv,are there any past years that have had a higher suicide rate in comparison to other years ?
Suicide.csv,do any years have much larger suicide rates than any other year ?
Suicide.csv,were there any years with a lot more suicides than any other year ?
Suicide.csv,is there any years with suicide rates that are much bigger than that of other years ?
Suicide.csv,can you show me any years that have significantly higher suicide rates ?
Suicide.csv,do some years exist with suicide rates that are much larger than that of other years ?
Suicide.csv,is there some years has more suicide rates than others ?
Suicide.csv,are there any years with suicide rates that are a lot bigger than that of different years ?
Suicide.csv,are there any suicide rate years that spike higher than other years ?
Suicide.csv,is there any years in which the rate of suicide is bigger than the rate of other years .
Suicide.csv,"which , if any , years are the suicide rates a lot higher than other years ?"
Suicide.csv,do you see any specific years where the rate of suicide is significantly greater ?
Suicide.csv,show me years that have significantly greater rates of suicide .
Suicide.csv,can you find years in which the suicide rate are larger than other years ?
International football results from 1872 to 2019.csv,show the extreme matches in which the score difference is more than 5 .
International football results from 1872 to 2019.csv,where are the extreme matches with a score difference of more than 5 ?
International football results from 1872 to 2019.csv,which extreme matches have a score difference of more than five ?
International football results from 1872 to 2019.csv,can you tell me the extreme matches in which there is a score diffrence of more than 5 ?
International football results from 1872 to 2019.csv,display any outlying matches that have a score difference of more than five .
International football results from 1872 to 2019.csv,what are the extreme matches where the score difference is more than 5 ?
International football results from 1872 to 2019.csv,which extreme matches have a score difference of more than 5 ?
International football results from 1872 to 2019.csv,identify the extreme matches in which the score differential is greater than 5 .
International football results from 1872 to 2019.csv,indicate the extreme matches with a score difference of more than 5 .
International football results from 1872 to 2019.csv,show only matches where the scores differ by more than 5 points .
International football results from 1872 to 2019.csv,examine the matches and find the extreme instances in which the differences in scores was greater than 5 .
International football results from 1872 to 2019.csv,"when the score difference is more than 5 , please list the extreme matches to this ."
International football results from 1872 to 2019.csv,find the matches the score difference was greater than 5 .
International football results from 1872 to 2019.csv,show me the most similair matches with a score differencial more than 5 .
International football results from 1872 to 2019.csv,identify any matches with big wins of greater than 5 difference in score
International football results from 1872 to 2019.csv,i 'd like to see any matches that have a score difference above five .
International football results from 1872 to 2019.csv,"if the score difference is extreme , more than 5 , i want you to show it to me ."
International football results from 1872 to 2019.csv,does the dataset have any anomalous matches in which the score difference is more than 5 ?
International football results from 1872 to 2019.csv,"look at the dataset , and see if any matches are anomalous , that is , they have a score difference greater than 5 ."
International football results from 1872 to 2019.csv,are there any anomalous matches with a score difference larger than 5 in the dataset ?
International football results from 1872 to 2019.csv,are there score differences of more than 5 in any of the anomalous matches in the dataset ?
International football results from 1872 to 2019.csv,are there any anomalous matches in the dataset in which the score difference is more than 5 ?
International football results from 1872 to 2019.csv,"within the dataset , are there any anomalous matches that have a score difference of more than 5 ?"
International football results from 1872 to 2019.csv,can you tell me if the dataset has any anomalous matches in which the difference in score is greater than 5 ?
International football results from 1872 to 2019.csv,do the results have any unexpected matches where the variation is greater than 5 ?
International football results from 1872 to 2019.csv,do the results show any anomalous matches where the score difference was more than 5 ?
International football results from 1872 to 2019.csv,does the dataset have any atypical matches with a score differencial greater than 5 ?
International football results from 1872 to 2019.csv,are there any unusual results with a difference of more than five in score ?
International football results from 1872 to 2019.csv,"are there any unusual matches , with a score difference of more than 5 , that stand out ?"
International football results from 1872 to 2019.csv,are there any anomalies in the data when the score difference is more than 5 ?
International football results from 1872 to 2019.csv,review this dataset and identify any anamalous matches with a score difference greater than 5 .
International football results from 1872 to 2019.csv,show me the dataset with any atypical matches in which the score diffrencer is more than 5 .
life-expectancy-by-state.csv,are there any anomalies in the growth rates of asian countries ?
life-expectancy-by-state.csv,please list any anomalies in asian countries growth rates .
life-expectancy-by-state.csv,are there any asian countries with anomalous growth rates ?
life-expectancy-by-state.csv,do the growth rates for asian countries have any anomalies ?
life-expectancy-by-state.csv,is there any anomalies in the growth rate of asian countries ?
life-expectancy-by-state.csv,do any asian countries have any anomalies in their growth rate ?
life-expectancy-by-state.csv,what are the anomalies in the growth rates of asian countries ?
life-expectancy-by-state.csv,is there any anomalies in the growth rates of asian countries ?
life-expectancy-by-state.csv,could you tell me if there are any anomalies within the data for the growth rates of asian countries ?
life-expectancy-by-state.csv,do any asian countries have anomalous growth rates ?
life-expectancy-by-state.csv,what anomalies are seen in the asian countries rates of growth ?
life-expectancy-by-state.csv,"in all asian countries , are there any variances in the growth rates ?"
life-expectancy-by-state.csv,list all the anomalies in the growth rates of all asian countries .
life-expectancy-by-state.csv,do asian countries have and differences in growth rates from other countries ?
life-expectancy-by-state.csv,retrieve the anomalies in the growth rates of asian countries .
life-expectancy-by-state.csv,in all the asian countires show me the anomalies in their growth rates .
life-expectancy-by-state.csv,are there any outliers in the mortality rates due to cancer in american states ?
life-expectancy-by-state.csv,what are the outliers in cancer mortality rates in american states ?
life-expectancy-by-state.csv,"in the mortality rates due to cancer in american states , have you found outliers ?"
life-expectancy-by-state.csv,do the us states have any outliers in their cancer mortality rates ?
life-expectancy-by-state.csv,show me outliers in the mortality rates due to cancer in american states ?
life-expectancy-by-state.csv,what are the outliers regarding cancer mortality rates across america ?
life-expectancy-by-state.csv,"in american states , what are the outliers in the mortality rates due to cancer ?"
life-expectancy-by-state.csv,do any american states have any outliers in their mortality rate due to cancer ?
life-expectancy-by-state.csv,show me the outliers in the mortality rates due to cancer in american states .
life-expectancy-by-state.csv,are any american states outliers in regard to cancer mortality rates ?
life-expectancy-by-state.csv,"in death rates due to cancer in america , are their any outliers ?"
life-expectancy-by-state.csv,in cancer rates in the united states are there any deviations in the mortality rates ?
life-expectancy-by-state.csv,is there any outliers included in the mortality rates due to cancer in america ?
life-expectancy-by-state.csv,are there any deaths from cancer that seem different than the majority of cancer deaths in america ?
life-expectancy-by-state.csv,"when you consider the mortality rates due to cancer , are there any american states that are outliers ?"
life-expectancy-by-state.csv,"in american states , are there any anomalies regarding cancer mortality rates ?"
life-expectancy-by-state.csv,are there any outliers inside the mortality charges because of cancer in american states ?
life-expectancy-by-state.csv,is there anything unusual about the vegetation coverage in brazil in recent years ?
life-expectancy-by-state.csv,has there been anything strange happening with brazil 's vegetation ground cover recently ?
life-expectancy-by-state.csv,"in recent years , are there any unusual observations about brazil 's vegetation coverage ?"
life-expectancy-by-state.csv,"in recent years , have you noticed anything abnormal about the vegetation coverage in brazil ?"
life-expectancy-by-state.csv,is there any abnormalities with the vegetative cover in brazil in recent years ?
life-expectancy-by-state.csv,can you tell me anything unusual about vegetation coverae in brazil in recent years ?
life-expectancy-by-state.csv,can you tell me if there is anything unusual about the vegetation coverage in brazil in recent years ?
life-expectancy-by-state.csv,is anything about the coverage of vegetation in brazil in recent years unusual ?
life-expectancy-by-state.csv,is there anything uncommon about the vegetation coverage in brazil in recent years ?
life-expectancy-by-state.csv,has brazil 's vegetation coverage been unusual in the past few years ?
life-expectancy-by-state.csv,"in recent years , tell me what is unusual about the vegetation in brazil ."
life-expectancy-by-state.csv,what anomalies occur with brazilian vegetation coverage in recent years ?
births.csv,find the outliers with extremely high gender ratios among the neighborhoods from 2014 to 2017 .
births.csv,show me the outliers with extremely high gender rations amongst the neighbourhoods from 2014 to 2017
births.csv,locate the extremely high gender ratio outliers among the neighborhoods from 2014 to 2017 .
births.csv,check the years from 2014 to 2017 for outliers where the gender ratio is extremely high .
births.csv,retrieve the outliers that have extremely high gender ratios in the neighborhoods from 2014 to 2017 .
births.csv,show me outliers of high gender ratios among neighborhoods between 2014 and 2017
births.csv,"locate the outliers , amongst the neighborhoods , with extremely high gender ratios from 2014 to 2017 ."
births.csv,research for outliers in neighborhoods with severly high gender ratios from the year 2014 to 2017 .
births.csv,locate the outliers with very elevated gender ratios throughout the communities from 2014 to 2017 .
births.csv,search the outliers with paramount gender ratios among the neighborhoods from 2014 to 2017 .
births.csv,can you look for the outliers with extremely high gender ratios among the neighborhoods from 2014 to 2017 ?
births.csv,which neighborhoods had female to male birth ratios that were outside of the normal range from 2014 to 2017 ?
births.csv,please show me from the years 2014 to 2017 the extremely high gender ratios among the neighborhoods of the outliers ?
births.csv,find the extremely high gender ratios from the neighborhoods between 2014 and 2017 .
births.csv,where there any very high differences in gender ratios in the neighborhood between 2014 and 2017 ?
top250-00-19.csv,is it possible to buy a player with a transfer fee lower than his market value ?
top250-00-19.csv,can you buy a transfer player for less than his market value ?
top250-00-19.csv,can you purchase a player with a transfer fee lower than their market value ?
top250-00-19.csv,can you buy a player with a transfer fee for lower than his market value ?
top250-00-19.csv,can a player be bought with a transfer fee lower than his market value ?
top250-00-19.csv,can one buy a player with a transfer fee lower than his market value ?
top250-00-19.csv,can you buy a player with a transfer fee lower than his market value ?
top250-00-19.csv,can you tell me if it is possible to buy a player with a transfer fee lower than his market value ?
top250-00-19.csv,can you purchase a player with lower transfer fee than the market value ?
top250-00-19.csv,could you buy a player with his market value higher than a transfer fee ?
top250-00-19.csv,is there a possible way to buy a player with a transfer fee that is lower than the market value ?
top250-00-19.csv,can an individual buy a player with a transfer fee lower than his market value ?
top250-00-19.csv,can i buy a player with a transfer fee under his market value ?
top250-00-19.csv,can a player with a transfer fee be bought less than his market value ?
top250-00-19.csv,can a player be bought if his transfer fee is lower than his market value ?
top250-00-19.csv,can transferred players be bought for prices lower than their market value ?
top250-00-19.csv,show me if it is possible to buy a player with a transfer fee lower than his market value .
top250-00-19.csv,if a player has a transfer fee that is lower than his market value can that player be bought ?
marry.csv,select the area that has more divorced people than married people .
marry.csv,highlight the region with more divorcees than married .
marry.csv,please choose the area that has a greater number of divored than it has married people .
marry.csv,please indicate the area that contains a greater number of divorced individuals versus married individuals .
marry.csv,highlight the area that has more divorced people than married people .
marry.csv,show me the area that has more divorce people than married people
marry.csv,can you choose the area that has more divorced people than married people ?
marry.csv,what area has more divorced people than married people ?
marry.csv,pick the region with more divorced people than those who are married .
marry.csv,please choose the area in which there are less married people than divorced people .
marry.csv,in which region can you find more divorced people than married couples ?
marry.csv,show me the area that contains less married people than divorced people
top250-00-19.csv,is there any player whose transfer_fee was two times larger than his market_fee ?
top250-00-19.csv,identify if there were any players that had a transfer_fee that was double their market_fee .
top250-00-19.csv,are there any players whose transfer_fee was twice the amount of his market_fee ?
top250-00-19.csv,are there any players whose transfer_fee has been double his market_fee ?
top250-00-19.csv,can you tell us if any players transfer_fee was two times larger than his market_fee ?
top250-00-19.csv,"what players , if any , had a transfer_fee that was twice as large as their market_fee ?"
top250-00-19.csv,has any player exceeded their market valuation by double their transfer fee ?
top250-00-19.csv,which players have a transfer_fee that is two times larger than his market_fee ?
top250-00-19.csv,are there any players whose transfer free was twice as large as their market fee ?
top250-00-19.csv,which players ' transfer_fee was double their market_fee
